{
  "event_id": "018f8b45-b634-7c81-a47d-9a7c2f3c2201",
  "event_type": "article.cleaned",
  "event_version": 1,
  "occurred_at": "2026-08-01T00:03:00Z",
  "producer": "article-service",
  "correlation_id": "018f8b45-b634-7c81-a47d-9a7c2f3c2102",
  "causation_id": "018f8b45-b634-7c81-a47d-9a7c2f3c2101",
  "aggregate_type": "article_version",
  "aggregate_id": "018f8b45-b634-7c81-a47d-9a7c2f3c2202",
  "idempotency_key": "article-version:018f8b45-b634-7c81-a47d-9a7c2f3c2202:cleaned:v1",
  "payload": {
    "source_id": "018f8b45-b634-7c81-a47d-9a7c2f3c2104",
    "article_id": "018f8b45-b634-7c81-a47d-9a7c2f3c2103",
    "article_version_id": "018f8b45-b634-7c81-a47d-9a7c2f3c2202",
    "canonical_url": "https://www.bbc.com/sport/football/articles/example",
    "title": "Real Madrid open contract talks with Vinicius Junior",
    "content_hash": "aaaaaaaaaaaaaaaaaaaaaaaaaaaaaaaaaaaaaaaaaaaaaaaaaaaaaaaaaaaaaaaa",
    "language": "en",
    "cleaned_at": "2026-08-01T00:02:55Z",
    "mongo_collection": "source_articles",
    "mongo_document_id": "66abfc100000000000000001",
    "duplicate_type": "NONE",
    "duplicate_of_article_version_id": null
  }
}
